"Story","Title","Result","Date","Stability","Duration (s)"
"Firma Pagare Deceval","Consulta de pagare en deceval sin pdf","SUCCESS","11:48:19","0.0","10.47"
"Firma Pagare Deceval","Consulta de pagare en deceval con pdf","SUCCESS","11:48:31","0.0","4.94"
"Firma Pagare Deceval","usuario envia solicitud de consulta pagare con pdf con id inexistente","SUCCESS","11:49:23","0.0","2.45"
"Firma Pagare Deceval","usuario envia solicitud de consulta con fecha hoy incorrecta","SUCCESS","11:49:26","0.0","2.15"
"Firma Pagare Deceval","usuario envia solicitud de consulta sin algun campo obligatorio","SUCCESS","11:49:28","0.0","1.01"
